{
  "schema_version": "1.0",
  "generated_at": "2026-06-07T10:00:00+08:00",
  "run_id": "2026-06-07-resume-test",
  "status": "partial",
  "steps": [
    {
      "skill": "collect-market-overview",
      "status": "complete",
      "output_file": "market-overview.json",
      "completed_at": "2026-06-07T10:05:00+08:00"
    },
    {
      "skill": "collect-blogger-updates",
      "status": "complete",
      "output_file": "blogger-updates.json",
      "completed_at": "2026-06-07T10:10:00+08:00"
    }
  ]
}